{
  "brief": "Assess whether a launch loop should scale or replan after public order/review signals and search context for 'turquoise pillows'.",
  "case_id": "opensku-scale-004",
  "category": "Accent Pillows",
  "evaluation_tags": [
    "public_signal_context",
    "forbidden_metric_trap",
    "stage_diagnosis",
    "promotion_replan",
    "knowledge_delta"
  ],
  "expected_decision": "Scale",
  "expected_decision_rationale": "Scale decisions require loop evidence and explicit limitations. The case can use public order/review/search fixtures but cannot infer causal uplift.",
  "forbidden_claims": [
    "Do not state GMV, CTR, CVR, ROI, CAC, ad spend, margin, refund rate, repeat purchase rate, or verified uplift unless those exact fields are present.",
    "Do not call public benchmark rows live merchant telemetry."
  ],
  "public_context": [
    {
      "component": "orders",
      "dataset": "olist",
      "fields": [
        "order_status",
        "order_purchase_timestamp",
        "order_estimated_delivery_date"
      ],
      "note": "Order lifecycle context for loop diagnosis.",
      "row_index": 3,
      "sample_file": "data/opensku/samples/olist.jsonl",
      "source_type": "public_benchmark_fixture"
    },
    {
      "component": "order_reviews",
      "dataset": "olist",
      "fields": [
        "review_score",
        "review_comment_title",
        "review_comment_message"
      ],
      "note": "Review context for knowledge deltas.",
      "row_index": 3,
      "sample_file": "data/opensku/samples/olist.jsonl",
      "source_type": "public_benchmark_fixture"
    },
    {
      "component": "query",
      "dataset": "wands",
      "fields": [
        "query",
        "query_class"
      ],
      "note": "Search context for scale positioning.",
      "row_index": 3,
      "sample_file": "data/opensku/samples/wands.jsonl",
      "source_type": "public_benchmark_fixture"
    }
  ],
  "required_artifacts": [
    "launch-war-room.html",
    "evidence-ledger.json",
    "competitor-table.csv",
    "positioning-brief.md",
    "listing-pack.md",
    "content-pack.md",
    "launch-calendar.csv",
    "launch-state.json",
    "promotion-replan.md",
    "knowledge-deltas.json"
  ],
  "required_claims": [
    "State that the evidence comes from public benchmark fixtures.",
    "Name at least one material limitation of the available evidence."
  ],
  "scoring_notes": {
    "must_include_replan_or_knowledge_delta": true,
    "must_reference_evidence": true,
    "primary_failure_mode": "claiming causal uplift from public fixture context"
  },
  "source_dataset": [
    "olist",
    "wands"
  ],
  "stage": "scale_iterate",
  "uploaded_real": []
}
