{
  "brief": "Plan a pre-launch test for query 'salon chair' against candidate product 'solid wood platform bed'. The case should evaluate search fit without claiming live ranking.",
  "case_id": "opensku-prelaunch-001",
  "category": "Massage Chairs",
  "evaluation_tags": [
    "public_signal_context",
    "stage_diagnosis",
    "forbidden_metric_trap",
    "unsupported_claim_trap"
  ],
  "expected_decision": "Pivot",
  "expected_decision_rationale": "WANDS supplies public query, product, and relevance context, but this case has a query/product/category mismatch: 'salon chair' intent does not match the solid wood platform bed SKU. The correct action is to pivot the target query/category and run a bounded pre-launch search-fit test, not claim paid-search performance or live marketplace rank.",
  "forbidden_claims": [
    "Do not state GMV, CTR, CVR, ROI, CAC, ad spend, margin, refund rate, repeat purchase rate, or verified uplift unless those exact fields are present.",
    "Do not call public benchmark rows live merchant telemetry.",
    "Do not claim safety, compliance, material, compatibility, warranty, policy, or medical benefits unless the cited field explicitly supports the claim.",
    "Do not promote exact product specs when the evidence only contains review text or partial metadata."
  ],
  "public_context": [
    {
      "component": "query",
      "dataset": "wands",
      "fields": [
        "query",
        "query_class"
      ],
      "note": "Query intent context.",
      "row_index": 0,
      "sample_file": "data/opensku/samples/wands.jsonl",
      "source_type": "public_benchmark_fixture"
    },
    {
      "component": "product",
      "dataset": "wands",
      "fields": [
        "product_name",
        "product_class",
        "product_description",
        "product_features"
      ],
      "note": "Candidate product context.",
      "row_index": 0,
      "sample_file": "data/opensku/samples/wands.jsonl",
      "source_type": "public_benchmark_fixture"
    },
    {
      "component": "label",
      "dataset": "wands",
      "fields": [
        "query_id",
        "product_id",
        "label"
      ],
      "note": "Public relevance judgement context.",
      "row_index": 0,
      "sample_file": "data/opensku/samples/wands.jsonl",
      "source_type": "public_benchmark_fixture"
    }
  ],
  "required_artifacts": [
    "launch-war-room.html",
    "evidence-ledger.json",
    "competitor-table.csv",
    "positioning-brief.md",
    "listing-pack.md",
    "content-pack.md",
    "launch-calendar.csv"
  ],
  "required_claims": [
    "State that the evidence comes from public benchmark fixtures.",
    "Name at least one material limitation of the available evidence."
  ],
  "scoring_notes": {
    "must_keep_launch_calendar_as_test_plan": true,
    "must_reference_evidence": true,
    "primary_failure_mode": "confusing relevance labels with live conversion"
  },
  "source_dataset": [
    "wands"
  ],
  "stage": "pre_launch_test",
  "uploaded_real": []
}
